{"decisionId":"44444444-4444-4444-8444-444444444444","subjectType":"Prediction","subjectId":"11111111-1111-4111-8111-111111111111","site":"LU","decision":"Confirm","reviewerId":"entra:maintenance-engineer-lu-01","reviewerRole":"Maintenance","rationale":"Thermal trend matches prior lining-degradation replay and lead time is actionable.","decidedAt":"2026-06-21T10:20:00Z","resultingWorkOrderId":null}
